{
  "schemaVersion": 1,
  "packageClassificationSha256": "a8a069a2946c2e93f92121378d57857da4f038fac000e4f73ff4c465de320365",
  "pathRepairsSha256": "8157d74014064be02a360c77a4610c889c8998798504da2930d8cf8794bcb2ad",
  "sourceAliasesSha256": "9cd5ee9d7f562643132f93326f8bf88ff96dfb4b03291fb3827437517af2dd57",
  "turboJsonSha256": "4986207ed3f2a393671625acbf4f8fa06947696379423e2c046e2d8e9093d4c7",
  "rootLockPredecessorSha256": "48658cc4a8d4c76a9a6eb314c9da54afd54ccea370d6c0c337d6095efbe8d258",
  "rootLockSha256": "20af880a5aada78ea950e515adaffbf5ae67ac497b0755e4070cda676168b996",
  "runtime": {
    "node": "v24.19.0",
    "npm": "11.17.0",
    "imageDigest": "sha256:56ab6ddaab798f0664b18448a1226bfa9e43aefaa90af280ff79d05c350a2ef8"
  },
  "normalizedEnvironment": {
    "CI": "true",
    "HUSKY": "0",
    "LC_ALL": "C",
    "NODE_ENV": "production",
    "TZ": "UTC"
  },
  "artifactPolicy": {
    "directory": ".artifacts/packages",
    "naming": "package-version-sha256.tgz",
    "npmPackArgv": [
      "npm",
      "pack",
      "--ignore-scripts",
      "--json",
      "--pack-destination"
    ],
    "forbiddenPatterns": [
      "(^|/)node_modules(/|$)",
      "(^|/)(src|test|tests|examples|integration-tests)(/|$)",
      "(^|/)package-lock.json$",
      "(^|/)(tsconfig|typedoc|vitest|jest|karma|rollup|rolldown|webpack|eslint)[^/]*$",
      "(^|/)downstream_projects.json$",
      "(^|/)artifacts.json$",
      "(^|/).*\\.legacy(\\.[^/]*)?$",
      "migration/source-aliases.json",
      "tools/source-aliases.cjs"
    ],
    "sourceMapPolicy": "relative normalized sources only; no absolute path, repository root, source-alias helper, or repository-relative package source entrypoint may appear",
    "repetitions": 2,
    "waivers": []
  },
  "consumer": {
    "sandbox": "outside-repository-ancestry",
    "name": "@uirouter/p01-packed-consumer",
    "sentinelPackage": "@uirouter/p01-root-sentinel",
    "lockArgv": [
      "npm",
      "install",
      "--package-lock-only",
      "--ignore-scripts",
      "--no-audit",
      "--no-fund",
      "--loglevel=error"
    ],
    "installArgv": [
      "npm",
      "ci",
      "--ignore-scripts",
      "--no-audit",
      "--no-fund",
      "--loglevel=error"
    ],
    "dependencies": {
      "@angular/common": "22.1.3",
      "@angular/compiler": "22.1.3",
      "@angular/core": "22.1.3",
      "@angular/upgrade": "22.1.3",
      "@types/angular": "1.8.9",
      "@types/jquery": "3.5.34",
      "@types/node": "24.13.3",
      "@types/react": "19.2.18",
      "@types/react-dom": "19.2.5",
      "angular": "1.8.3",
      "jsdom": "27.4.0",
      "react": "19.2.8",
      "react-dom": "19.2.8",
      "react-redux": "9.3.0",
      "redux": "5.0.1",
      "rxjs": "7.8.2",
      "zone.js": "0.16.2"
    },
    "typecheck": {
      "typescript": "5.9.3",
      "command": [
        "node_modules/.bin/tsc",
        "--project",
        "tsconfig.json",
        "--noEmit"
      ]
    },
    "bundler": {
      "package": "esbuild",
      "version": "0.28.2",
      "command": [
        "node_modules/.bin/esbuild",
        "bundler-probe.ts",
        "--bundle",
        "--format=esm",
        "--platform=browser",
        "--outfile=bundler-probe.mjs"
      ]
    }
  },
  "packages": [
    {
      "id": "core",
      "owner": "p01-production-pack",
      "sourceManifest": "core/package.json",
      "manifest": "core/package.json",
      "manifestSha256": "6c30c200abdcf84f00fca48518116b9c768f8a4a8f522d73092bdbfe1d6a0f42",
      "scriptsSha256": "5c9bfdff07d47a662a7029d833843459f024293f8ae41e6c710d02f47456e3ad",
      "package": "@uirouter/core",
      "version": "6.1.2",
      "kind": "library",
      "build": {
        "script": "build",
        "cleanPaths": ["lib", "lib-esm", "_bundles"],
        "outputs": ["lib/**", "lib-esm/**", "_bundles/**"]
      },
      "pack": {
        "script": "pack",
        "directory": ".",
        "allowed": [
          "package.json",
          "README.md",
          "LICENSE",
          "lib/**",
          "lib-esm/**",
          "_bundles/**"
        ],
        "required": [
          "package.json",
          "lib/index.js",
          "lib/index.d.ts",
          "lib-esm/index.js",
          "_bundles/ui-router-core.js",
          "_bundles/ui-router-core.min.js"
        ]
      },
      "internalEdgeIds": [],
      "entrypoints": [
        {
          "id": "core-require",
          "mode": "require",
          "specifier": "@uirouter/core",
          "target": "lib/index.js",
          "export": "UIRouter"
        },
        {
          "id": "core-bundler",
          "mode": "bundler-import",
          "specifier": "@uirouter/core",
          "target": "lib-esm/index.js",
          "export": "UIRouter"
        },
        {
          "id": "core-types",
          "mode": "types",
          "specifier": "@uirouter/core",
          "target": "lib/index.d.ts",
          "export": "UIRouter"
        }
      ]
    },
    {
      "id": "angular",
      "owner": "p01-production-pack",
      "sourceManifest": "framework/angular/router/package.json",
      "manifest": "frameworks/angular/uirouter-angular/package.json",
      "manifestSha256": "2b42a55a2b99a75e08953a3115905f8c5b0ad33091b41aac4b9249665aae2ba7",
      "scriptsSha256": "2751a6c48e857320024024493bde02c962546ec97da643a80011d5907a54285c",
      "package": "@uirouter/angular",
      "version": "22.0.0",
      "kind": "angular-library",
      "build": {
        "script": "build",
        "cleanPaths": ["dist"],
        "outputs": ["dist/**"]
      },
      "pack": {
        "script": "pack",
        "directory": "dist",
        "allowed": [
          "package.json",
          "README.md",
          "LICENSE",
          "fesm2022/**",
          "types/**"
        ],
        "required": [
          "package.json",
          "fesm2022/uirouter-angular.mjs",
          "types/uirouter-angular.d.ts"
        ]
      },
      "internalEdgeIds": [
        "edge-framework-angular-router-peerdependencies-uirouter-core",
        "edge-framework-angular-router-peerdependencies-uirouter-rx"
      ],
      "entrypoints": [
        {
          "id": "angular-import",
          "mode": "node-import",
          "specifier": "@uirouter/angular",
          "target": "fesm2022/uirouter-angular.mjs",
          "export": "UIRouterModule"
        },
        {
          "id": "angular-types",
          "mode": "types",
          "specifier": "@uirouter/angular",
          "target": "types/uirouter-angular.d.ts",
          "export": "UIRouterModule"
        }
      ]
    },
    {
      "id": "angular-hybrid",
      "owner": "p01-production-pack",
      "sourceManifest": "framework/angular-hybrid/router/package.json",
      "manifest": "frameworks/angular-hybrid/uirouter-angular-hybrid/package.json",
      "manifestSha256": "20ee6ee0cfecf41d7da6ea6dab31e8b30e489a249ba679b11292d3b069c7d6b2",
      "scriptsSha256": "dce6c915e29128ab7a2cfd7efd6f39a8e6026fb05446cef05b4d7581ed6dcdda",
      "package": "@uirouter/angular-hybrid",
      "version": "22.0.0",
      "kind": "angular-library",
      "build": {
        "script": "build",
        "cleanPaths": ["dist"],
        "outputs": ["dist/**"]
      },
      "pack": {
        "script": "pack",
        "directory": "dist",
        "allowed": [
          "package.json",
          "README.md",
          "LICENSE",
          "fesm2022/**",
          "types/**"
        ],
        "required": [
          "package.json",
          "fesm2022/uirouter-angular-hybrid.mjs",
          "types/uirouter-angular-hybrid.d.ts"
        ]
      },
      "internalEdgeIds": [
        "edge-framework-angular-hybrid-router-peerdependencies-uirouter-angular",
        "edge-framework-angular-hybrid-router-peerdependencies-uirouter-angularjs",
        "edge-framework-angular-hybrid-router-peerdependencies-uirouter-core"
      ],
      "entrypoints": [
        {
          "id": "angular-hybrid-import",
          "mode": "node-import",
          "specifier": "@uirouter/angular-hybrid",
          "target": "fesm2022/uirouter-angular-hybrid.mjs",
          "export": "UIRouterUpgradeModule"
        },
        {
          "id": "angular-hybrid-types",
          "mode": "types",
          "specifier": "@uirouter/angular-hybrid",
          "target": "types/uirouter-angular-hybrid.d.ts",
          "export": "UIRouterUpgradeModule"
        }
      ]
    },
    {
      "id": "angularjs",
      "owner": "p01-production-pack",
      "sourceManifest": "framework/angularjs/router/package.json",
      "manifest": "frameworks/angularjs/uirouter-angularjs/package.json",
      "manifestSha256": "66d98f4602d49bf359fc8d2a94d9504766afcb553673f773fcfa49479736b0e1",
      "scriptsSha256": "0d5ee7913c8bfdf5810462f832eb3f1c92f89b1b2d58c2f19dccd79819077f0d",
      "package": "@uirouter/angularjs",
      "version": "1.1.2",
      "kind": "library",
      "build": {
        "script": "build",
        "cleanPaths": ["lib", "lib-esm", "release"],
        "outputs": ["lib/**", "lib-esm/**", "release/**"]
      },
      "pack": {
        "script": "pack",
        "directory": ".",
        "allowed": [
          "package.json",
          "README.md",
          "LICENSE",
          "DOCS.md",
          "lib/**",
          "lib-esm/**",
          "release/**"
        ],
        "required": [
          "package.json",
          "lib/index.d.ts",
          "lib-esm/index.js",
          "release/ui-router-angularjs.js",
          "release/ui-router-angularjs.min.js"
        ]
      },
      "internalEdgeIds": [
        "edge-framework-angularjs-router-peerdependencies-uirouter-core"
      ],
      "entrypoints": [
        {
          "id": "angularjs-require",
          "mode": "require",
          "specifier": "@uirouter/angularjs",
          "target": "release/ui-router-angularjs.js",
          "export": "UIRouter"
        },
        {
          "id": "angularjs-bundler",
          "mode": "bundler-import",